{
  "id": "fire-hydrant",
  "name": "Fire hydrant",
  "kind": "exercise",
  "type": "isolation",
  "level": "beginner",
  "equipment": ["none"],
  "bodyweight": true,
  "areas": { "glutes": 1 },
  "instructions": [
    "Start on hands and knees, back flat.",
    "Keeping your knee bent, lift one leg out to the side.",
    "Lower with control and repeat, then switch sides."
  ],
  "cue": "Knee bent, lift out to the side",
  "mistakes": ["Rotating the hips to lift higher.", "Rushing the lowering phase."],
  "variants": ["hip-thrust-bodyweight", "glute-bridge", "donkey-kick"],
  "timed": false,
  "source": "workoutlab",
  "license": "LicenseRef-workoutLab"
}
