{
  "id": "superman",
  "name": "Superman hold",
  "kind": "exercise",
  "type": "compound",
  "level": "beginner",
  "equipment": ["none"],
  "bodyweight": true,
  "areas": { "back": 1, "glutes": 0.5 },
  "instructions": [
    "Lie face down with arms stretched out in front of you.",
    "Lift your arms, chest and legs off the floor together.",
    "Hold, then lower back down with control."
  ],
  "cue": "Lift chest, arms and legs together",
  "mistakes": ["Yanking the head back.", "Only lifting the arms."],
  "variants": ["bird-dog", "prone-swimmers", "reverse-plank-hold", "prone-y-raise"],
  "timed": false,
  "source": "workoutlab",
  "license": "LicenseRef-workoutLab"
}
